<?xml version="1.0" encoding="UTF-8"?>
<panelvuelos xmlns:xsi="http://www.w3.org/2001/XMLSchema-instance"
          xsi:noNamespaceSchemaLocation="vuelos.xsd">
    <vuelo codigo="v22" >

       <diario> </diario>
        <origen>New york</origen>
        <destino>Chicago</destino>
        <horasalida>10:15</horasalida>
       <horallegada>12:15</horallegada>
       <estado>C</estado>

    </vuelo>

    <vuelo codigo="V23">

        <diario> </diario>
        <origen>New York</origen>
        <destino>Miami</destino>
        <horasalida>9:30</horasalida>
        <horallegada>11:30</horallegada>
        <estado>C</estado>
    </vuelo>


</panelvuelos>